23:37:00.513551 ARP, Request who-has 172.25.210.22 tell 172.25.210.254, length 46
23:37:00.513693 ARP, Request who-has 172.25.210.29 tell 172.25.210.254, length 46
23:37:00.790297 IP maks-Lenovo-IdeaPad-Z510 > 224.0.0.251: igmp v2 report 224.0.0.251
23:37:01.031699 IP 192.168.1.110 > 224.0.0.252: igmp v2 report 224.0.0.252
23:37:01.242595 IP maks-Lenovo-IdeaPad-Z510.57527 > gateway.domain: 62580+ PTR? 22.210.25.172.in-addr.arpa. (44)
23:37:01.336869 ARP, Request who-has maks-Lenovo-IdeaPad-Z510 tell gateway, length 28
23:37:01.336893 ARP, Reply maks-Lenovo-IdeaPad-Z510 is-at fc:f8:ae:8c:1b:fd (oui Unknown), length 28
23:37:01.340098 IP gateway.domain > maks-Lenovo-IdeaPad-Z510.57527: 62580 NXDomain* 0/1/0 (79)
23:37:01.340527 IP maks-Lenovo-IdeaPad-Z510.55752 > 172.25.210.22.hostmon: Flags [S], seq 1774589085, win 29200, options [mss 1460,sackOK,TS val 1376689 ecr 0,nop,wscale 7], length 0
23:37:01.343083 IP gateway > maks-Lenovo-IdeaPad-Z510: ICMP time exceeded in-transit, length 68
23:37:01.346995 IP maks-Lenovo-IdeaPad-Z510.57527 > gateway.domain: 12799+ PTR? 254.210.25.172.in-addr.arpa. (45)
23:37:01.352636 IP gateway.domain > maks-Lenovo-IdeaPad-Z510.57527: 12799 NXDomain* 0/1/0 (80)
23:37:01.494593 IP maks-Lenovo-IdeaPad-Z510.32936 > 172.25.210.254.hostmon: Flags [S], seq 2470750768, win 29200, options [mss 1460,sackOK,TS val 1376728 ecr 0,nop,wscale 7], length 0
23:37:01.496874 IP gateway > maks-Lenovo-IdeaPad-Z510: ICMP time exceeded in-transit, length 68
23:37:01.502842 IP maks-Lenovo-IdeaPad-Z510.57527 > gateway.domain: 59843+ PTR? 29.210.25.172.in-addr.arpa. (44)
23:37:01.509814 IP gateway.domain > maks-Lenovo-IdeaPad-Z510.57527: 59843 NXDomain* 0/1/0 (79)
23:37:01.546108 ARP, Request who-has 172.25.210.22 tell 172.25.210.254, length 46
23:37:01.546126 ARP, Request who-has 172.25.210.29 tell 172.25.210.254, length 46
23:37:01.612081 IP maks-Lenovo-IdeaPad-Z510.54308 > 172.25.210.29.hostmon: Flags [S], seq 2444943475, win 29200, options [mss 1460,sackOK,TS val 1376757 ecr 0,nop,wscale 7], length 0
23:37:01.614108 IP gateway > maks-Lenovo-IdeaPad-Z510: ICMP time exceeded in-transit, length 68
23:37:01.616805 IP maks-Lenovo-IdeaPad-Z510.57527 > gateway.domain: 47488+ PTR? 251.0.0.224.in-addr.arpa. (42)
23:37:01.621373 IP gateway.domain > maks-Lenovo-IdeaPad-Z510.57527: 47488 NXDomain 0/1/0 (99)
23:37:01.742157 ARP, Request who-has 172.25.202.254 (Broadcast) tell 172.25.202.12, length 46
23:37:01.747541 IP maks-Lenovo-IdeaPad-Z510.57527 > gateway.domain: 63662+ PTR? 104.1.168.192.in-addr.arpa. (44)
23:37:01.750219 IP maks-Lenovo-IdeaPad-Z510.57527 > gateway.domain: 15144+ PTR? 252.0.0.224.in-addr.arpa. (42)
23:37:01.753087 IP gateway.domain > maks-Lenovo-IdeaPad-Z510.57527: 63662 NXDomain* 0/1/0 (79)
23:37:01.758767 IP gateway.domain > maks-Lenovo-IdeaPad-Z510.57527: 15144 NXDomain 0/1/0 (99)
23:37:01.760889 IP maks-Lenovo-IdeaPad-Z510.57527 > gateway.domain: 28625+ PTR? 110.1.168.192.in-addr.arpa. (44)
23:37:01.765330 IP gateway.domain > maks-Lenovo-IdeaPad-Z510.57527: 28625 NXDomain* 0/1/0 (79)
23:37:01.918754 IP maks-Lenovo-IdeaPad-Z510.37398 > 192.168.1.110.hostmon: Flags [S], seq 1824479966, win 29200, options [mss 1460,sackOK,TS val 1376834 ecr 0,nop,wscale 7], length 0
23:37:02.263997 IP maks-Lenovo-IdeaPad-Z510.57527 > gateway.domain: 15704+ PTR? 1.1.168.192.in-addr.arpa. (42)
23:37:02.268021 IP gateway.domain > maks-Lenovo-IdeaPad-Z510.57527: 15704 NXDomain* 0/1/0 (77)
23:37:02.410549 IP maks-Lenovo-IdeaPad-Z510.59208 > gateway.hostmon: Flags [S], seq 583054427, win 29200, options [mss 1460,sackOK,TS val 1376957 ecr 0,nop,wscale 7], length 0
23:37:02.412037 IP gateway.hostmon > maks-Lenovo-IdeaPad-Z510.59208: Flags [R.], seq 0, ack 583054428, win 0, length 0
23:37:02.414641 IP maks-Lenovo-IdeaPad-Z510.57527 > gateway.domain: 52905+ PTR? 254.202.25.172.in-addr.arpa. (45)
23:37:02.418771 IP gateway.domain > maks-Lenovo-IdeaPad-Z510.57527: 52905 NXDomain* 0/1/0 (80)
23:37:02.422346 IP maks-Lenovo-IdeaPad-Z510 > 224.0.0.252: igmp v2 report 224.0.0.252
23:37:02.467377 ARP, Request who-has 172.25.202.254 tell 172.25.202.1, length 46
23:37:02.494533 IP maks-Lenovo-IdeaPad-Z510.60092 > 172.25.202.254.hostmon: Flags [S], seq 808927586, win 29200, options [mss 1460,sackOK,TS val 1376978 ecr 0,nop,wscale 7], length 0
23:37:02.495573 IP gateway > maks-Lenovo-IdeaPad-Z510: ICMP time exceeded in-transit, length 68
23:37:02.498984 IP maks-Lenovo-IdeaPad-Z510.57527 > gateway.domain: 12444+ PTR? 12.202.25.172.in-addr.arpa. (44)
23:37:02.503159 IP gateway.domain > maks-Lenovo-IdeaPad-Z510.57527: 12444 NXDomain* 0/1/0 (79)
23:37:02.628306 IP maks-Lenovo-IdeaPad-Z510.37462 > 172.25.202.12.hostmon: Flags [S], seq 1483802044, win 29200, options [mss 1460,sackOK,TS val 1377011 ecr 0,nop,wscale 7], length 0
23:37:02.630417 IP gateway > maks-Lenovo-IdeaPad-Z510: ICMP time exceeded in-transit, length 68
23:37:03.289982 IP maks-Lenovo-IdeaPad-Z510.57527 > gateway.domain: 54754+ PTR? 1.202.25.172.in-addr.arpa. (43)
23:37:03.300025 IP gateway.domain > maks-Lenovo-IdeaPad-Z510.57527: 54754 NXDomain* 0/1/0 (78)
23:37:03.427655 IP maks-Lenovo-IdeaPad-Z510.43752 > 172.25.202.1.hostmon: Flags [S], seq 556702317, win 29200, options [mss 1460,sackOK,TS val 1377211 ecr 0,nop,wscale 7], length 0
23:37:03.432475 IP gateway > maks-Lenovo-IdeaPad-Z510: ICMP time exceeded in-transit, length 68
23:37:06.153715 ARP, Request who-has 172.25.8.254 tell 172.25.8.1, length 46
23:37:06.262329 ARP, Request who-has gateway tell maks-Lenovo-IdeaPad-Z510, length 28
23:37:06.264885 ARP, Reply gateway is-at b0:48:7a:e8:11:16 (oui Unknown), length 28
23:37:06.361980 IP maks-Lenovo-IdeaPad-Z510.57527 > gateway.domain: 11904+ PTR? 254.8.25.172.in-addr.arpa. (43)
23:37:06.367899 IP gateway.domain > maks-Lenovo-IdeaPad-Z510.57527: 11904 NXDomain* 0/1/0 (78)
23:37:06.368372 IP maks-Lenovo-IdeaPad-Z510.41774 > 172.25.8.254.hostmon: Flags [S], seq 52531010, win 29200, options [mss 1460,sackOK,TS val 1377946 ecr 0,nop,wscale 7], length 0
23:37:06.369643 IP gateway > maks-Lenovo-IdeaPad-Z510: ICMP time exceeded in-transit, length 68
23:37:06.373607 IP maks-Lenovo-IdeaPad-Z510.57527 > gateway.domain: 7074+ PTR? 1.8.25.172.in-addr.arpa. (41)
23:37:06.376304 IP gateway.domain > maks-Lenovo-IdeaPad-Z510.57527: 7074 NXDomain* 0/1/0 (76)
23:37:06.494665 IP maks-Lenovo-IdeaPad-Z510.53606 > 172.25.8.1.hostmon: Flags [S], seq 2857532224, win 29200, options [mss 1460,sackOK,TS val 1377978 ecr 0,nop,wscale 7], length 0
23:37:06.496113 IP gateway > maks-Lenovo-IdeaPad-Z510: ICMP time exceeded in-transit, length 68
23:37:07.030302 ARP, Request who-has 192.168.1.110 tell maks-Lenovo-IdeaPad-Z510, length 28
23:37:07.036674 ARP, Reply 192.168.1.110 is-at 94:de:80:08:30:a1 (oui Unknown), length 46
23:37:09.225599 ARP, Request who-has 172.25.209.254 tell 172.25.209.1, length 46
23:37:09.434328 IP maks-Lenovo-IdeaPad-Z510.57527 > gateway.domain: 7746+ PTR? 254.209.25.172.in-addr.arpa. (45)
23:37:09.439394 IP gateway.domain > maks-Lenovo-IdeaPad-Z510.57527: 7746 NXDomain* 0/1/0 (80)
23:37:09.494580 IP maks-Lenovo-IdeaPad-Z510.53980 > 172.25.209.254.hostmon: Flags [S], seq 2684739499, win 29200, options [mss 1460,sackOK,TS val 1378728 ecr 0,nop,wscale 7], length 0
23:37:09.496004 IP gateway > maks-Lenovo-IdeaPad-Z510: ICMP time exceeded in-transit, length 68
23:37:09.500957 IP maks-Lenovo-IdeaPad-Z510.57527 > gateway.domain: 38741+ PTR? 1.209.25.172.in-addr.arpa. (43)
23:37:09.504930 IP gateway.domain > maks-Lenovo-IdeaPad-Z510.57527: 38741 NXDomain* 0/1/0 (78)
23:37:09.677919 IP maks-Lenovo-IdeaPad-Z510.50022 > 172.25.209.1.hostmon: Flags [S], seq 2220946732, win 29200, options [mss 1460,sackOK,TS val 1378773 ecr 0,nop,wscale 7], length 0
23:37:09.679186 IP gateway > maks-Lenovo-IdeaPad-Z510: ICMP time exceeded in-transit, length 68
23:37:09.729647 ARP, Request who-has 172.25.191.254 tell 172.25.191.1, length 46
23:37:10.457068 IP maks-Lenovo-IdeaPad-Z510.57527 > gateway.domain: 23953+ PTR? 254.191.25.172.in-addr.arpa. (45)
23:37:10.462541 IP gateway.domain > maks-Lenovo-IdeaPad-Z510.57527: 23953 NXDomain* 0/1/0 (80)
23:37:10.494527 IP maks-Lenovo-IdeaPad-Z510.60674 > 172.25.191.254.hostmon: Flags [S], seq 2323413855, win 29200, options [mss 1460,sackOK,TS val 1378978 ecr 0,nop,wscale 7], length 0
23:37:10.495934 IP gateway > maks-Lenovo-IdeaPad-Z510: ICMP time exceeded in-transit, length 68
23:37:10.498713 IP maks-Lenovo-IdeaPad-Z510.57527 > gateway.domain: 49749+ PTR? 1.191.25.172.in-addr.arpa. (43)
23:37:10.501073 IP gateway.domain > maks-Lenovo-IdeaPad-Z510.57527: 49749 NXDomain* 0/1/0 (78)
23:37:10.638563 IP maks-Lenovo-IdeaPad-Z510.55710 > 172.25.191.1.hostmon: Flags [S], seq 3757204746, win 29200, options [mss 1460,sackOK,TS val 1379014 ecr 0,nop,wscale 7], length 0
23:37:10.639810 IP gateway > maks-Lenovo-IdeaPad-Z510: ICMP time exceeded in-transit, length 68
23:37:12.703254 ARP, Request who-has 172.25.211.254 tell 172.25.211.209, length 46
23:37:13.219483 ARP, Request who-has 172.25.196.254 tell 172.25.196.200, length 46
23:37:13.219776 ARP, Request who-has 172.25.184.254 tell 172.25.184.203, length 46
23:37:13.529282 IP maks-Lenovo-IdeaPad-Z510.57527 > gateway.domain: 31890+ PTR? 254.211.25.172.in-addr.arpa. (45)
23:37:13.534632 IP gateway.domain > maks-Lenovo-IdeaPad-Z510.57527: 31890 NXDomain* 0/1/0 (80)
23:37:13.625003 ARP, Request who-has 172.25.75.254 tell 172.25.75.210, length 46
23:37:13.690850 IP maks-Lenovo-IdeaPad-Z510.41634 > 172.25.211.254.hostmon: Flags [S], seq 3628984295, win 29200, options [mss 1460,sackOK,TS val 1379777 ecr 0,nop,wscale 7], length 0
23:37:13.692379 IP gateway > maks-Lenovo-IdeaPad-Z510: ICMP time exceeded in-transit, length 68
23:37:13.696682 IP maks-Lenovo-IdeaPad-Z510.57527 > gateway.domain: 32095+ PTR? 209.211.25.172.in-addr.arpa. (45)
23:37:13.709977 IP gateway.domain > maks-Lenovo-IdeaPad-Z510.57527: 32095 NXDomain* 0/1/0 (80)
23:37:13.845175 IP maks-Lenovo-IdeaPad-Z510.44574 > 172.25.211.209.hostmon: Flags [S], seq 437202014, win 29200, options [mss 1460,sackOK,TS val 1379815 ecr 0,nop,wscale 7], length 0
23:37:13.846276 IP gateway > maks-Lenovo-IdeaPad-Z510: ICMP time exceeded in-transit, length 68
23:37:13.851585 IP maks-Lenovo-IdeaPad-Z510.57527 > gateway.domain: 32656+ PTR? 254.196.25.172.in-addr.arpa. (45)
23:37:13.855201 IP gateway.domain > maks-Lenovo-IdeaPad-Z510.57527: 32656 NXDomain* 0/1/0 (80)
23:37:13.994587 IP maks-Lenovo-IdeaPad-Z510.39148 > 172.25.196.254.hostmon: Flags [S], seq 872375002, win 29200, options [mss 1460,sackOK,TS val 1379853 ecr 0,nop,wscale 7], length 0
23:37:13.995813 IP gateway > maks-Lenovo-IdeaPad-Z510: ICMP time exceeded in-transit, length 68
23:37:13.999408 IP maks-Lenovo-IdeaPad-Z510.57527 > gateway.domain: 18503+ PTR? 200.196.25.172.in-addr.arpa. (45)
23:37:14.002983 IP gateway.domain > maks-Lenovo-IdeaPad-Z510.57527: 18503 NXDomain* 0/1/0 (80)
23:37:14.115336 IP maks-Lenovo-IdeaPad-Z510.38208 > 172.25.196.200.hostmon: Flags [S], seq 880153389, win 29200, options [mss 1460,sackOK,TS val 1379883 ecr 0,nop,wscale 7], length 0
23:37:14.116619 IP gateway > maks-Lenovo-IdeaPad-Z510: ICMP time exceeded in-transit, length 68
23:37:14.120677 IP maks-Lenovo-IdeaPad-Z510.57527 > gateway.domain: 50949+ PTR? 254.184.25.172.in-addr.arpa. (45)
23:37:14.124402 IP gateway.domain > maks-Lenovo-IdeaPad-Z510.57527: 50949 NXDomain* 0/1/0 (80)
23:37:14.124733 IP maks-Lenovo-IdeaPad-Z510.52238 > 172.25.184.254.hostmon: Flags [S], seq 642013348, win 29200, options [mss 1460,sackOK,TS val 1379885 ecr 0,nop,wscale 7], length 0
23:37:14.125489 IP gateway > maks-Lenovo-IdeaPad-Z510: ICMP time exceeded in-transit, length 68
23:37:14.128898 IP maks-Lenovo-IdeaPad-Z510.57527 > gateway.domain: 30685+ PTR? 203.184.25.172.in-addr.arpa. (45)
23:37:14.132843 IP gateway.domain > maks-Lenovo-IdeaPad-Z510.57527: 30685 NXDomain* 0/1/0 (80)
23:37:14.141071 ARP, Request who-has 172.25.210.22 tell 172.25.210.254, length 46
23:37:14.141455 ARP, Request who-has 172.25.184.205 tell 172.25.184.254, length 46
23:37:14.141805 ARP, Request who-has 172.25.18.211 tell 172.25.18.254, length 46
23:37:14.142182 ARP, Request who-has 172.25.208.201 tell 172.25.208.254, length 46
23:37:14.142639 ARP, Request who-has 172.25.181.201 tell 172.25.181.254, length 46
23:37:14.143023 ARP, Request who-has 172.25.158.201 tell 172.25.158.254, length 46
23:37:14.143440 ARP, Request who-has 172.25.18.203 tell 172.25.18.254, length 46
23:37:14.144883 ARP, Request who-has 172.25.170.210 tell 172.25.170.254, length 46
23:37:14.144896 ARP, Request who-has 172.25.212.200 tell 172.25.212.254, length 46
23:37:14.144899 ARP, Request who-has 172.25.194.201 tell 172.25.194.254, length 46
23:37:14.144902 ARP, Request who-has 172.25.170.207 tell 172.25.170.254, length 46
23:37:14.145263 ARP, Request who-has 172.25.188.206 tell 172.25.188.254, length 46
23:37:14.146706 ARP, Request who-has 172.25.183.211 tell 172.25.183.254, length 46
23:37:14.146719 ARP, Request who-has 172.25.19.201 tell 172.25.19.254, length 46
23:37:14.146724 ARP, Request who-has 172.25.184.202 tell 172.25.184.254, length 46
23:37:14.146727 ARP, Request who-has 172.25.196.201 tell 172.25.196.254, length 46
23:37:14.244588 IP maks-Lenovo-IdeaPad-Z510.49218 > 172.25.184.203.hostmon: Flags [S], seq 278874398, win 29200, options [mss 1460,sackOK,TS val 1379915 ecr 0,nop,wscale 7], length 0
23:37:14.245912 IP gateway > maks-Lenovo-IdeaPad-Z510: ICMP time exceeded in-transit, length 68

